{
  "profession": {
    "name": "ML-инженер",
    "slug": "machine_learning_engineer",
    "aliases": ["Machine Learning Engineer", "ML Engineer"]
  },
  "grades": ["junior", "middle", "senior"],
  "source": {
    "type": "file",
    "path": "sample_vacancies.json"
  },
  "dictionaries": {
    "nodes": "../dictionaries/canonical_nodes.json"
  },
  "rules": {
    "phrases": "../rules/phrase_rules.json",
    "splits": "../rules/split_rules.json"
  },
  "graph": {
    "min_children": 3,
    "min_count": 1,
    "target_depth": 4,
    "max_depth": 6,
    "depth_status": "TEMPORARY: minimal demo hierarchy"
  },
  "grade_rules": {
    "conflict_policy": "keep_best",
    "mode": "experience_then_salary",
    "title": 5,
    "text": 1,
    "experience": 3,
    "salary": 3,
    "conflict_score_margin": 2,
    "conflict_min_score": 3,
    "junior_max_years": 1,
    "middle_max_years": 4,
    "salary_currency": "RUR",
    "junior_max_salary": 120000,
    "middle_max_salary": 250000,
    "default_grade": "middle",
    "signals": {}
  },
  "scoring": {
    "mode": "prevalence",
    "required": 1.0,
    "preferred": 0.75,
    "optional": 0.5,
    "unknown": 0.6,
    "negated": 0.0,
    "section_weights": {
      "requirements": 1.0,
      "responsibilities": 0.9,
      "advantages": 0.7,
      "conditions": 0.25,
      "company": 0.0,
      "unknown": 0.6
    },
    "max_employer_share": 0.4,
    "status": "APPROVED: count is unique vacancies with skill divided by all vacancies of the grade"
  },
  "learning": {
    "catalog": "../dictionaries/learning_resources.json",
    "max_per_node": 4,
    "check_links": false
  },
  "assets": {
    "template_version": "0.2",
    "known_icons": {}
  },
  "ai": {
    "enabled": false,
    "provider": null,
    "model": null,
    "base_url": null,
    "api_key_env": "PROFESSIONAL_GRAPHS_AI_KEY",
    "timeout_seconds": 45
  },
  "analysis": {
    "duplicate_title_threshold": 0.88,
    "duplicate_text_threshold": 0.82,
    "unknown_min_vacancies": 2,
    "unknown_limit": 50,
    "boilerplate_min_vacancies": 2,
    "boilerplate_min_chars": 80
  }
}
